{
  "rule_id": "RULE-017",
  "review_round": 1,
  "proposition_relation": {
    "status": "CONFIRMED",
    "expression": "P01 AND P02",
    "basis_quotes": [
      "证明本次就诊中‘电子生物反馈疗法’的实际执行次数与收费记录一致，且该执行频次符合临床诊疗规范及医保支付规则，不存在分解收费或多记次数。",
      "这是核心路径。原始描述指出‘收取次数异常’，医院需证明收费有对应的真实医疗行为支撑。需要核实治疗执行记录中的具体次数是否与费用明细中的数量完全匹配。",
      "若存在多次治疗，每次治疗具有独立的临床必要性（如针对不同身体部位、不同功能障碍模块或间隔足够长的独立疗程），符合多计次的合规条件。",
      "这是备选核验路径。如果收费次数大于1，仅证明‘做了’不够，还需证明‘为什么做这么多次’是合理的。需排除分解收费嫌疑。"
    ]
  },
  "fact_reviews": [
    {
      "proposition_id": "P01",
      "一级证据域": "治疗",
      "二级证据标签": "治疗过程",
      "target_fact": "本次就诊中‘电子生物反馈疗法’的具体执行次数、每次治疗的起止时间及治疗部位/参数设置。",
      "necessity": "REQUIRED",
      "status": "UNKNOWN",
      "evidence": [
        {
          "source": "DS-M-OP-001 门诊病历",
          "evidence_type": "MEDICAL_DOCUMENT",
          "document_id": "DOC-DS-M-OP-001-123306038-01",
          "location": "处理",
          "quote": "6.电子生物反馈疗法  每日1次  20天  20次"
        }
      ],
      "reason": "门诊病历仅记录了医嘱计划（每日1次，共20次），未提供本次就诊实际执行的具体次数、起止时间及参数设置。缺乏实际执行记录（如治疗单、执行记录单）来证明本次就诊实际发生了多少次治疗，无法与收费次数进行直接比对。"
    },
    {
      "proposition_id": "P01",
      "一级证据域": "费用",
      "二级证据标签": "收费明细",
      "target_fact": "‘电子生物反馈疗法’的收费项目编码、名称、单价及总收费次数。",
      "necessity": "REQUIRED",
      "status": "SUPPORTED",
      "evidence": [
        {
          "source": "DS-S-002 费用明细",
          "evidence_type": "STRUCTURED",
          "document_id": null,
          "location": "cnt",
          "quote": "20"
        },
        {
          "source": "DS-S-002 费用明细",
          "evidence_type": "STRUCTURED",
          "document_id": null,
          "location": "setName",
          "quote": "电子生物反馈疗法"
        },
        {
          "source": "DS-S-002 费用明细",
          "evidence_type": "STRUCTURED",
          "document_id": null,
          "location": "pric",
          "quote": "35"
        }
      ],
      "reason": "费用明细明确显示‘电子生物反馈疗法’收费数量为20次，单价35元，总金额700元。"
    },
    {
      "proposition_id": "P01",
      "一级证据域": "护理",
      "二级证据标签": "护理记录",
      "target_fact": "护士执行治疗时的签名记录或执行时间戳，用于交叉验证治疗发生的真实性。",
      "necessity": "SUPPLEMENTARY",
      "status": "UNKNOWN",
      "evidence": [],
      "reason": "查询结果为NOT_RETRIEVED，未获取到护理记录。"
    },
    {
      "proposition_id": "P02",
      "一级证据域": "诊断",
      "二级证据标签": "标准诊断",
      "target_fact": "患者当前的主要诊断及伴随症状，用于评估多部位或多模块治疗的合理性。",
      "necessity": "REQUIRED",
      "status": "SUPPORTED",
      "evidence": [
        {
          "source": "DS-S-003 诊断信息",
          "evidence_type": "STRUCTURED",
          "document_id": null,
          "location": "diseName",
          "quote": "产伤性腹直肌分离"
        }
      ],
      "reason": "诊断信息明确为‘产伤性腹直肌分离’。"
    },
    {
      "proposition_id": "P02",
      "一级证据域": "治疗",
      "二级证据标签": "治疗方案",
      "target_fact": "医生制定的康复治疗计划，是否明确包含多次或分部位的生物反馈治疗医嘱。",
      "necessity": "REQUIRED",
      "status": "UNKNOWN",
      "evidence": [],
      "reason": "查询结果为NOT_RETRIEVED，未获取到首次病程记录、会诊记录等详细治疗方案文档。虽然门诊病历中有处理意见，但缺乏更详细的康复计划文档来支撑多次治疗的临床必要性论证，且门诊病历中的医嘱仅为计划，非执行依据。"
    }
  ],
  "proposition_reviews": [
    {
      "proposition_id": "P01",
      "status": "UNKNOWN",
      "reason": "虽然收费次数（20次）已明确，但缺乏本次就诊实际执行次数的客观记录（如治疗执行单）。门诊病历仅显示医嘱计划，无法证明实际执行了20次，也无法排除‘少做多收’或‘分解收费’的可能性。关键事实‘实际执行次数’为UNKNOWN。"
    },
    {
      "proposition_id": "P02",
      "status": "UNKNOWN",
      "reason": "虽然诊断明确，但缺乏详细的治疗方案文档（NOT_RETRIEVED）来论证20次治疗的临床必要性及合理性。无法确认是否符合多计次的合规条件。"
    }
  ],
  "overall_logic_status": "UNKNOWN",
  "review_status": "OPEN",
  "case_status": "待补充证据",
  "final_conclusion": {
    "result": "暂无法判定",
    "is_final": false,
    "reason": "核心命题P01和P02均因关键证据缺失（实际执行记录、详细治疗方案）而处于UNKNOWN状态。无法确认收费次数与实际执行次数是否一致，也无法确认多次治疗的临床合理性。"
  },
  "supplemental_evidence_requests": [
    {
      "proposition_id": "P01",
      "target_fact": "本次就诊中‘电子生物反馈疗法’的具体执行次数、每次治疗的起止时间及治疗部位/参数设置。",
      "requested_data": "本次就诊期间‘电子生物反馈疗法’的实际治疗执行记录（如治疗单、执行记录单、设备运行日志等），需包含每次治疗的具体时间、部位及参数。",
      "requested_source": "DS-M-OP-001 门诊病历（补充执行记录部分）或院内治疗执行系统",
      "reason": "当前仅有医嘱计划，无实际执行记录。需补充执行记录以核对收费次数（20次）是否与实际执行一致，这是判断是否违规的核心依据。"
    },
    {
      "proposition_id": "P02",
      "target_fact": "医生制定的康复治疗计划，是否明确包含多次或分部位的生物反馈治疗医嘱。",
      "requested_data": "详细的康复治疗计划或病程记录，说明为何需要20次电子生物反馈疗法，以及每次治疗的具体目标和部位。",
      "requested_source": "DS-M-IP-003 首次病程记录、DS-M-IP-007 会诊记录、DS-M-IP-009 术前小结、DS-M-IP-010 术前讨论记录、DS-M-IP-002 入院记录",
      "reason": "当前缺乏详细治疗方案文档，无法论证20次治疗的临床必要性，需补充以排除分解收费嫌疑。"
    }
  ],
  "manual_review_reason": null
}
