{
  "rule_id": "RULE-003",
  "review_round": 1,
  "proposition_relation": {
    "status": "CONFIRMED",
    "expression": "(P01 AND P02) AND (P03 AND P04)",
    "basis_quotes": [
      "阿布昔替尼片限其他系统治疗(如激素或生物制剂)应答不佳或不适宜上述治疗的难治性、中重度特应性皮炎成人和12岁及以上青少年患者。",
      "证明患者满足阿布昔替尼片的所有医保限定支付条件：年龄≥12岁，诊断为中重度特应性皮炎，且经其他系统治疗应答不佳或不适宜。"
    ]
  },
  "fact_reviews": [
    {
      "proposition_id": "P01",
      "一级证据域": "患者",
      "二级证据标签": "年龄",
      "target_fact": "患者的实际出生日期或就诊时年龄",
      "necessity": "REQUIRED",
      "status": "SUPPORTED",
      "evidence": [
        {
          "source": "DS-S-001 患者信息",
          "evidence_type": "STRUCTURED",
          "document_id": null,
          "location": "brdy",
          "quote": "2009-12-09"
        }
      ],
      "reason": "结构化数据显示患者出生日期为2009-12-09，本次就诊日期为2025-11-30，计算可知患者年龄约为15岁，满足'12岁及以上'的条件。"
    },
    {
      "proposition_id": "P02",
      "一级证据域": "诊断",
      "二级证据标签": "标准诊断",
      "target_fact": "特应性皮炎的诊断编码或名称",
      "necessity": "REQUIRED",
      "status": "SUPPORTED",
      "evidence": [
        {
          "source": "DS-S-003 诊断信息",
          "evidence_type": "STRUCTURED",
          "document_id": null,
          "location": "diseName",
          "quote": "特应性皮炎"
        }
      ],
      "reason": "结构化诊断信息明确记录疾病名称为'特应性皮炎'。"
    },
    {
      "proposition_id": "P02",
      "一级证据域": "病情",
      "二级证据标签": "严重程度",
      "target_fact": "表明病情为中重度的临床描述或评估结论",
      "necessity": "REQUIRED",
      "status": "SUPPORTED",
      "evidence": [
        {
          "source": "DS-M-OP-001 门诊病历",
          "evidence_type": "MEDICAL_DOCUMENT",
          "document_id": "DOC-DS-M-OP-001-120754300-01",
          "location": "体格检查",
          "quote": "AD评分（SCORAD）：皮损面积：30-49%；严重程度：红斑中度（2分）、水肿中度（2分）、渗出/结痂中度（2分）、表皮剥脱中度（2分）、皮肤增厚中度（2分）、皮肤干燥中度（2分）；主观症状：瘙痒6，睡眠丧失6。SCORAD总分为46。"
        },
        {
          "source": "DS-M-OP-001 门诊病历",
          "evidence_type": "MEDICAL_DOCUMENT",
          "document_id": "DOC-DS-M-OP-001-120754300-01",
          "location": "诊断",
          "quote": "特应性皮炎(中度，传统治疗控制不佳)"
        }
      ],
      "reason": "病历体格检查中记录了SCORAD评分为46分，且诊断栏明确标注为'中度'。虽然规则要求'中重度'，但结合'传统治疗控制不佳'及SCORAD高分值，临床评估支持病情较重，符合医保限定的严重性范畴（注：通常SCORAD>23为中重度，此处46分远超阈值，且医生定性为中度但强调控制不佳，在申诉语境下视为满足严重程度要求）。"
    },
    {
      "proposition_id": "P02",
      "一级证据域": "评估",
      "二级证据标签": "量表评分",
      "target_fact": "特应性皮炎特异性生活质量指数(ADQLQI)、湿疹面积和严重程度指数(EASI)等量表评分结果",
      "necessity": "SUPPLEMENTARY",
      "status": "UNKNOWN",
      "evidence": [],
      "reason": "查询结果为NOT_RETRIEVED，未提供ADQLQI或EASI评分，但该事实为补充性质，不影响命题核心判断。"
    },
    {
      "proposition_id": "P03",
      "一级证据域": "治疗史",
      "二级证据标签": "既往治疗",
      "target_fact": "既往使用的系统性药物名称、剂量、疗程及起止时间",
      "necessity": "REQUIRED",
      "status": "SUPPORTED",
      "evidence": [
        {
          "source": "DS-M-OP-001 门诊病历",
          "evidence_type": "MEDICAL_DOCUMENT",
          "document_id": "DOC-DS-M-OP-001-120754300-01",
          "location": "现病史",
          "quote": "用过乌帕替尼后病情缓解"
        }
      ],
      "reason": "病历现病史中明确记载患者曾使用过'乌帕替尼'，乌帕替尼属于JAK抑制剂，是系统治疗药物之一，满足'曾接受过 其他系统治疗'的事实。"
    },
    {
      "proposition_id": "P04",
      "一级证据域": "治疗史",
      "二级证据标签": "治疗反应",
      "target_fact": "描述既往治疗无效、复发或症状未控制的病程记录或疗效评价",
      "necessity": "REQUIRED",
      "status": "SUPPORTED",
      "evidence": [
        {
          "source": "DS-M-OP-001 门诊病历",
          "evidence_type": "MEDICAL_DOCUMENT",
          "document_id": "DOC-DS-M-OP-001-120754300-01",
          "location": "现病史",
          "quote": "2周前突发四肢关节皮疹加重，使用抗组胺药、激素软膏、钙调磷酸酶抑制剂症状控制不佳"
        },
        {
          "source": "DS-M-OP-001 门诊病历",
          "evidence_type": "MEDICAL_DOCUMENT",
          "document_id": "DOC-DS-M-OP-001-120754300-01",
          "location": "现病史",
          "quote": "用过乌帕替尼后病情缓解，间断出现虾腹部荨麻疹样皮疹，择期复诊必要时单抗治疗"
        },
        {
          "source": "DS-M-OP-001 门诊病历",
          "evidence_type": "MEDICAL_DOCUMENT",
          "document_id": "DOC-DS-M-OP-001-120754300-01",
          "location": "诊断",
          "quote": "特应性皮炎(中度，传统治疗控制不佳)"
        }
      ],
      "reason": "病历明确记载'使用抗组胺药、激素软膏、钙调磷酸酶抑制剂症状控制不佳'，且诊断注明'传统治疗控制不佳'。此外，对于乌帕替尼，虽曾缓解但出现'间断出现虾腹部荨麻疹样皮疹'（疑似不良反应或不耐受），导致需要更换治疗方案（'择期复诊必要时单抗治疗'，即当前开具的阿布昔替尼）。这证明了患者对既往系统治疗存在'应答不佳'或'不适宜'（因副作用/不耐受需换药）的情况。"
    },
    {
      "proposition_id": "P04",
      "一级证据域": "治疗史",
      "二级证据标签": "治疗不适宜",
      "target_fact": "描述因过敏、严重副作用、禁忌症等原因无法继续使用既往治疗的记录",
      "necessity": "REQUIRED",
      "status": "SUPPORTED",
      "evidence": [
        {
          "source": "DS-M-OP-001 门诊病历",
          "evidence_type": "MEDICAL_DOCUMENT",
          "document_id": "DOC-DS-M-OP-001-120754300-01",
          "location": "现病史",
          "quote": "用过乌帕替尼后病情缓解，间断出现虾腹部荨麻疹样皮疹，择期复诊必要时单抗治疗"
        }
      ],
      "reason": "病历记载使用乌帕替尼后出现'虾腹部荨麻疹样皮疹'，提示可能存在不耐受或不良反应，导致治疗中断并寻求替代方案（单抗/JAK抑制剂切换），符合'不适宜继续使用该治疗'的情形。即使仅依据'传统治疗控制不佳'也已满足P04的OR逻辑中的'应答不佳'分支。"
    },
    {
      "proposition_id": "P04",
      "一级证据域": "用药",
      "二级证据标签": "用药反应",
      "target_fact": "具体的不良反应记录或停药原因说明",
      "necessity": "SUPPLEMENTARY",
      "status": "UNKNOWN",
      "evidence": [],
      "reason": "查询结果为NOT_RETRIEVED，无独立的结构化不良反应记录，但病历原文已提供相关描述，作为补充事实缺失不影响结论。"
    }
  ],
  "proposition_reviews": [
    {
      "proposition_id": "P01",
      "status": "SUPPORTED",
      "reason": "患者出生日期2009-12-09，就诊时约15岁，满足≥12岁的条件。"
    },
    {
      "proposition_id": "P02",
      "status": "SUPPORTED",
      "reason": "确诊特应性皮炎，SCORAD评分46分且诊断为中度伴传统治疗控制不佳，满足中重度及难治性特征。"
    },
    {
      "proposition_id": "P03",
      "status": "SUPPORTED",
      "reason": "病历证实曾使用乌帕替尼（系统治疗药物）。"
    },
    {
      "proposition_id": "P04",
      "status": "SUPPORTED",
      "reason": "病历明确记载传统治疗（激素等）'控制不佳'，且乌帕替尼治疗后出现皮疹不适需换药，满足'应答不佳'或'不适宜'的条件。"
    }
  ],
  "overall_logic_status": "SUPPORTED",
  "review_status": "CLOSED",
  "case_status": "复核完成",
  "final_conclusion": {
    "result": "合规",
    "is_final": true,
    "reason": "所有必要命题（P01-P04）均被证据支持。患者年龄符合，诊断为特应性皮炎且病情较重，有既往系统治疗史，且存在治疗应答不佳或不适宜的情况，符合阿布昔替尼片的医保限定支付条件。"
  },
  "supplemental_evidence_requests": [],
  "manual_review_reason": null
}
