{
  "rule_id": "RULE-018",
  "review_round": 1,
  "proposition_relation": {
    "status": "CONFIRMED",
    "expression": "P01",
    "basis_quotes": [
      "证明本次开具地屈孕酮片的临床指征符合医保规定的‘内源性孕酮不足引起的疾病’或‘辅助生殖技术中的黄体支持’范围，从而推翻超适应症用药的认定。",
      "患者本次就诊的临床诊断明确指向‘内源性孕酮不足引起的疾病’（如黄体功能不全、因孕酮缺乏导致的月经失调、先兆流产等）或处于‘辅助生殖技术周期中需要黄体支持’的阶段。"
    ]
  },
  "fact_reviews": [
    {
      "proposition_id": "P01",
      "一级证据域": "诊断",
      "二级证据标签": "标准诊断",
      "target_fact": "本次就诊的主要诊断及次要诊断名称及编码，特别是是否包含黄体功能不全、先兆流产、复发性流产、辅助生殖相关诊断等。",
      "necessity": "REQUIRED",
      "status": "SUPPORTED",
      "evidence": [
        {
          "source": "DS-S-003 诊断信息",
          "evidence_type": "STRUCTURED",
          "document_id": null,
          "location": "diseName",
          "quote": "早发性卵巢功能不全"
        },
        {
          "source": "DS-S-003 诊断信息",
          "evidence_type": "STRUCTURED",
          "document_id": null,
          "location": "diseName",
          "quote": "继发性闭经"
        }
      ],
      "reason": "结构化诊断数据显示患者诊断为‘早发性卵巢功能不全’和‘继发性闭经’。早发性卵巢功能不全（POI）导致卵巢功能衰退，雌激素和孕酮分泌不足，属于内源性孕酮不足引起的疾病范畴；继发性闭经也是激素水平异常的表现。这些诊断支持使用地屈孕酮进行激素替代治疗或调整月经周期，符合‘内源性孕酮不足引起的疾病’这一适应症。"
    },
    {
      "proposition_id": "P01",
      "一级证据域": "病史",
      "二级证据标签": "现病史",
      "target_fact": "患者本次发病的原因、主要症状（如阴道流血、腹痛）、既往孕产史及本次妊娠/治疗背景，以佐证是否存在孕酮不足或需要黄体支持的临床情境。",
      "necessity": "REQUIRED",
      "status": "SUPPORTED",
      "evidence": [
        {
          "source": "DS-M-OP-001 门诊病历",
          "evidence_type": "MEDICAL_DOCUMENT",
          "document_id": "DOC-DS-M-OP-001-121982058-01",
          "location": "内容",
          "quote": "外阴不适2025-10-12 黄体酮后半期10天。LMP 1-27,3天。12-23黄体酮10天1-20戊酸雌二醇/雌二醇环丙孕酮片(进口) 2mg/1mg月经1-27，3天。未停药否认手术史否认药物过敏史P3，剖宫产3次暂无生育计划宫颈癌筛查已告知。"
        },
        {
          "source": "DS-M-OP-001 门诊病历",
          "evidence_type": "MEDICAL_DOCUMENT",
          "document_id": "DOC-DS-M-OP-001-121982058-01",
          "location": "辅助检查",
          "quote": "2025-09-16 性激素(2):PROG 0.45ng/ml... 2025-09-19 抗缪勒氏管激素(AMH):AMH 0.04ng/ml↓... 2025-09-19 性激素六项:E2 24ng/L，HFSH 62.67mIU/ml"
        }
      ],
      "reason": "病历记录显示患者有‘早发性卵巢功能不全’病史，既往使用黄体酮和雌孕激素序贯治疗。辅助检查显示AMH极低（0.04ng/ml），FSH升高（62.67mIU/ml），PROG（孕酮）0.45ng/ml，提示卵巢储备功能严重下降及内源性激素水平低下。患者主诉外阴不适，诊断为继发性闭经，临床情境明确指向因卵巢功能不全导致的内源性孕酮不足，需要外源性孕酮（地屈孕酮）进行支持治疗。"
    },
    {
      "proposition_id": "P01",
      "一级证据域": "检验",
      "二级证据标签": "检验结果",
      "target_fact": "血清孕酮水平检测结果或其他激素水平检测数据，用于客观证实‘内源性孕酮不足’的存在。",
      "necessity": "SUPPLEMENTARY",
      "status": "SUPPORTED",
      "evidence": [
        {
          "source": "DS-M-OP-001 门诊病历",
          "evidence_type": "MEDICAL_DOCUMENT",
          "document_id": "DOC-DS-M-OP-001-121982058-01",
          "location": "辅助检查",
          "quote": "2025-09-16 性激素(2):PROG 0.45ng/ml"
        }
      ],
      "reason": "虽然独立的检验报告单未检索到，但门诊病历的‘辅助检查’字段中明确记录了2025-09-16的孕酮（PROG）检测结果为0.45ng/ml，该数值较低，佐证了内源性孕酮不足的事实。"
    },
    {
      "proposition_id": "P01",
      "一级证据域": "检查",
      "二级证据标签": "影像结果",
      "target_fact": "B超检查结果，如子宫内膜厚度、孕囊发育情况等，辅助判断是否需要黄体支持或是否存在先兆流产迹象。",
      "necessity": "SUPPLEMENTARY",
      "status": "SUPPORTED",
      "evidence": [
        {
          "source": "DS-M-OP-001 门诊病历",
          "evidence_type": "MEDICAL_DOCUMENT",
          "document_id": "DOC-DS-M-OP-001-121982058-01",
          "location": "辅助检查",
          "quote": "2026-01-20 经阴道彩色多普勒超声检查 子宫肌瘤（浆膜下）。双侧卵巢卵泡少，考虑卵巢储备功能下降可能"
        }
      ],
      "reason": "门诊病历中记录了2026-01-20的B超结果，显示‘双侧卵巢卵泡少，考虑卵巢储备功能下降可能’，这与早发性卵巢功能不全的诊断一致，进一步支持了因卵巢功能衰退导致的激素不足，从而需要黄体支持的临床逻辑。"
    }
  ],
  "proposition_reviews": [
    {
      "proposition_id": "P01",
      "status": "SUPPORTED",
      "reason": "患者诊断为‘早发性卵巢功能不全’和‘继发性闭经’，病历及辅助检查证实卵巢储备功能下降、孕酮水平低。地屈孕酮用于治疗此类内源性孕酮不足引起的疾病，符合医保规定的适应症范围。所有REQUIRED事实均得到支持。"
    }
  ],
  "overall_logic_status": "SUPPORTED",
  "review_status": "CLOSED",
  "case_status": "复核完成",
  "final_conclusion": {
    "result": "合规",
    "is_final": true,
    "reason": "证据充分证明患者因‘早发性卵巢功能不全’导致内源性孕酮不足，开具地屈孕酮片符合‘内源性孕酮不足引起的疾病’这一医保支付适应症，不属于超适应症用药。"
  },
  "supplemental_evidence_requests": [],
  "manual_review_reason": null
}
